{
  "pr": {
    "number": 101,
    "title": "feat(auth): add OAuth2 token refresh + telemetry hooks",
    "url": "https://github.com/example/repo/pull/101",
    "state": "OPEN",
    "is_draft": false,
    "author": "carol",
    "branch": { "head": "feat/oauth-refresh", "base": "main" },
    "changes": { "additions": 187, "deletions": 42, "files": 6 },
    "body": "기존 OAuth2 access token은 1시간 후 만료되는데 client 가 refresh 흐름을 갖고 있지 않아 매번 재로그인했음. 이번 PR 에서 refresh token rotation 을 추가하고, 토큰 갱신 실패시 Sentry 에 metadata 같이 적재되도록 telemetry hook 도 같이 묶었음."
  },
  "owner": "example",
  "repo": "repo",
  "repo_root": "/Users/seok/development/example/repo",
  "reviews": {
    "approved": 0,
    "changes_requested": 1,
    "commented": 1,
    "by_reviewer": [
      {
        "login": "bob",
        "state": "CHANGES_REQUESTED",
        "body": "전체적으로 좋은데 token rotation 구간에 race condition 위험 있어보임. inline comment 참고.",
        "submitted_at": "2026-05-15T09:12:00Z",
        "comment_numbers": [1, 4]
      },
      {
        "login": "alice",
        "state": "COMMENTED",
        "body": "telemetry payload 에 PII가 안 들어가는지만 확인 부탁",
        "submitted_at": "2026-05-15T10:30:00Z",
        "comment_numbers": [2, 3, 5]
      }
    ]
  },
  "resolved_hidden_count": 2,
  "include_resolved": false,
  "comments": [
    {
      "number": 1,
      "database_id": 3243171001,
      "thread_id": "PRRT_kwDOAAAAAA0000001",
      "url": "https://github.com/example/repo/pull/101#discussion_r3243171001",
      "updated_at": "2026-05-15T09:12:00Z",
      "last_edited_at": null,
      "is_outdated": false,
      "resolved_by": null,
      "validity": "valid",
      "tag": "blocking",
      "path": "src/auth/token.ts",
      "line": 87,
      "reviewer": "bob",
      "resolved": false,
      "body": "refresh 요청 사이에 lock 이 없어서, 두 개 요청이 동시에 들어오면 둘 다 새 token 을 발급받고 한쪽이 invalid 가 됨. mutex 또는 dedup queue 필요.",
      "summary": "토큰 갱신 race condition",
      "replies": [
        { "database_id": 3243171501, "author": "carol", "body": "맞네요. 이미 in-flight 인 promise 를 캐싱하는 방식으로 처리할게요." }
      ],
      "related": [
        { "path": "src/auth/token.ts", "line": 42, "note": "기존 access token 캐싱 로직" },
        { "path": "src/lib/lock.ts", "line": 8, "note": "재사용 가능한 mutex" }
      ],
      "rationale": "동시 호출 테스트 케이스가 없고, dedup 로직 누락 확인. 실 사용 시 충분히 재현 가능.",
      "recommendation": "수정",
      "recommendation_reason": "in-flight promise 캐싱으로 dedup",
      "diff_hunk": "@@ -82,6 +82,12 @@ export async function refreshToken(client) {\n   const stored = await store.get();\n   if (!stored.refresh_token) throw new MissingRefreshTokenError();\n+\n+  const res = await fetch(client.refreshUrl, {\n+    method: 'POST',\n+    body: JSON.stringify({ refresh_token: stored.refresh_token }),\n+  });\n+  const next = await res.json();\n   await store.set(next);\n   return next.access_token;"
    },
    {
      "number": 2,
      "database_id": 3243171002,
      "thread_id": "PRRT_kwDOAAAAAA0000002",
      "url": "https://github.com/example/repo/pull/101#discussion_r3243171002",
      "updated_at": "2026-05-15T10:30:00Z",
      "last_edited_at": null,
      "is_outdated": false,
      "resolved_by": null,
      "validity": "valid",
      "tag": "blocking",
      "path": "src/telemetry/sentry.ts",
      "line": 24,
      "reviewer": "alice",
      "resolved": false,
      "body": "여기 user 객체 통째로 들어가는데 email 이나 phone 같은 PII 가 sentry 에 그대로 적재됨. allowlist 만 추리거나 user_id 만 보내야 함.",
      "summary": "PII 누수 위험",
      "replies": [],
      "related": [
        { "path": "src/auth/user.ts", "line": 12, "note": "User 타입에 email/phone 포함" }
      ],
      "rationale": "Sentry 에 PII 직접 전송은 사내 정책상 금지. allowlist 필요 확인됨.",
      "recommendation": "수정",
      "recommendation_reason": "id/role 만 추출해서 전송",
      "diff_hunk": "@@ -22,4 +22,6 @@ export function reportAuthError(err, user) {\n   Sentry.captureException(err, {\n-    extra: { user },\n+    extra: { user },  // TODO allowlist\n+    tags: { auth_step: err.step },\n   });"
    },
    {
      "number": 3,
      "database_id": 3243171003,
      "thread_id": "PRRT_kwDOAAAAAA0000003",
      "url": "https://github.com/example/repo/pull/101#discussion_r3243171003",
      "updated_at": "2026-05-15T10:30:00Z",
      "last_edited_at": null,
      "is_outdated": false,
      "resolved_by": null,
      "validity": "partial",
      "tag": "suggestion",
      "path": "src/auth/token.ts",
      "line": 145,
      "reviewer": "alice",
      "resolved": false,
      "body": "이 retry loop 의 backoff 가 linear 인데 jitter 추가하면 thundering herd 줄어듭니다. 다만 현재 호출량 보면 critical 하진 않음.",
      "summary": "backoff jitter 추가 제안",
      "replies": [],
      "related": [],
      "rationale": "타당한 제안이지만 현재 호출량(분당 수십건) 에서는 영향 미미. 이슈로 분리해 추적하는 게 적절.",
      "recommendation": "이슈 생성",
      "recommendation_reason": "PR 범위 밖, 별도 개선 작업",
      "diff_hunk": "@@ -142,7 +142,10 @@ async function retry(fn) {\n   for (let i = 0; i < MAX; i++) {\n     try { return await fn(); }\n-    catch (e) { await sleep(BASE_MS * (i + 1)); }\n+    catch (e) {\n+      await sleep(BASE_MS * (i + 1));\n+    }\n   }"
    },
    {
      "number": 4,
      "database_id": 3243171004,
      "thread_id": "PRRT_kwDOAAAAAA0000004",
      "url": "https://github.com/example/repo/pull/101#discussion_r3243171004",
      "updated_at": "2026-05-15T09:12:00Z",
      "last_edited_at": null,
      "is_outdated": false,
      "resolved_by": null,
      "validity": "invalid",
      "tag": "suggestion",
      "path": "src/auth/store.ts",
      "line": 18,
      "reviewer": "bob",
      "resolved": false,
      "body": "이 부분 localStorage 대신 SecureStorage 쓰는 게 맞지 않나요? token 이 평문으로 노출됨.",
      "summary": "SecureStorage 권장",
      "replies": [],
      "related": [
        { "path": "src/auth/store.ts", "line": 5, "note": "interface Store - 추상화 계층" },
        { "path": "src/auth/store.web.ts", "line": 1, "note": "웹 어댑터 (localStorage)" },
        { "path": "src/auth/store.native.ts", "line": 1, "note": "네이티브 어댑터 (Keychain/Keystore)" }
      ],
      "rationale": "Store 가 platform별 어댑터로 추상화되어 있고, 네이티브에서는 이미 SecureStorage 사용. 지적 위치는 웹 fallback.",
      "recommendation": "반박",
      "recommendation_reason": "이미 platform별 추상화되어 있음",
      "diff_hunk": "@@ -16,4 +16,6 @@ export class WebStore implements Store {\n   async get() { return JSON.parse(localStorage.getItem('auth') || '{}'); }\n-  async set(v) { localStorage.setItem('auth', JSON.stringify(v)); }\n+  async set(v) {\n+    localStorage.setItem('auth', JSON.stringify(v));\n+  }"
    },
    {
      "number": 5,
      "database_id": 3243171005,
      "thread_id": "PRRT_kwDOAAAAAA0000005",
      "url": "https://github.com/example/repo/pull/101#discussion_r3243171005",
      "updated_at": "2026-05-15T10:30:00Z",
      "last_edited_at": null,
      "is_outdated": false,
      "resolved_by": null,
      "validity": "unclear",
      "tag": "question",
      "path": "src/telemetry/sentry.ts",
      "line": 41,
      "reviewer": "alice",
      "resolved": false,
      "body": "이 sampleRate 0.1 은 의도하신 건가요? 너무 낮아서 실제 에러 트래픽 추적이 안 될 것 같아요.",
      "summary": "sampleRate 의도 확인",
      "replies": [],
      "related": [],
      "rationale": "기존 prod 설정과 비교 필요. 비용 vs 가시성 trade-off 라 정책 결정 영역.",
      "recommendation": "논의",
      "recommendation_reason": "비용/가시성 정책 확인 필요",
      "diff_hunk": "@@ -38,5 +38,5 @@ export function initSentry(env) {\n   Sentry.init({\n     dsn: env.SENTRY_DSN,\n-    sampleRate: 1.0,\n+    sampleRate: 0.1,\n   });"
    }
  ],
  "processing_order": [1, 2, 3, 5, 4],
  "generated_at": "2026-05-17T12:00:00Z"
}
