{
  "pr": {
    "number": 101,
    "title": "feat(auth): add OAuth2 token refresh + telemetry hooks",
    "url": "https://github.com/example/repo/pull/101",
    "state": "OPEN",
    "is_draft": false,
    "author": "carol",
    "branch": { "head": "feat/oauth-refresh", "base": "main" },
    "changes": { "additions": 162, "deletions": 38, "files": 5 },
    "body": "기존 OAuth2 access token은 1시간 후 만료되는데 client 가 refresh 흐름을 갖고 있지 않아 매번 재로그인했음."
  },
  "owner": "example",
  "repo": "repo",
  "repo_root": "/Users/seok/development/example/repo",
  "reviews": {
    "approved": 0,
    "changes_requested": 1,
    "commented": 1,
    "by_reviewer": [
      { "login": "bob", "state": "CHANGES_REQUESTED", "body": "race condition 위험.", "comment_numbers": [1, 4] },
      { "login": "alice", "state": "COMMENTED", "body": "PII 확인 부탁", "comment_numbers": [2, 3] }
    ]
  },
  "resolved_hidden_count": 1,
  "include_resolved": false,
  "comments": [
    {
      "number": 1,
      "database_id": 3243171001,
      "thread_id": "PRRT_kwDOAAAAAA0000001",
      "url": "https://github.com/example/repo/pull/101#discussion_r3243171001",
      "updated_at": "2026-05-15T09:12:00Z",
      "last_edited_at": null,
      "is_outdated": false,
      "resolved_by": null,
      "validity": "valid",
      "tag": "blocking",
      "path": "src/auth/token.ts",
      "line": 87,
      "reviewer": "bob",
      "resolved": false,
      "body": "refresh 요청 사이에 lock 이 없어서, 두 개 요청이 동시에 들어오면 둘 다 새 token 을 발급받고 한쪽이 invalid 가 됨. mutex 또는 dedup queue 필요.",
      "summary": "토큰 갱신 race condition",
      "replies": [],
      "related": [],
      "rationale": "동시 호출 dedup 누락.",
      "recommendation": "수정",
      "recommendation_reason": "in-flight promise 캐싱",
      "diff_hunk": ""
    },
    {
      "number": 2,
      "database_id": 3243171002,
      "thread_id": "PRRT_kwDOAAAAAA0000002",
      "url": "https://github.com/example/repo/pull/101#discussion_r3243171002",
      "updated_at": "2026-05-14T15:00:00Z",
      "last_edited_at": null,
      "is_outdated": false,
      "resolved_by": null,
      "validity": "valid",
      "tag": "suggestion",
      "path": "src/telemetry/sentry.ts",
      "line": 24,
      "reviewer": "alice",
      "resolved": false,
      "body": "user 객체 통째로 넣지 마세요. (edit 전 본문)",
      "summary": "PII 누수 가능성",
      "replies": [],
      "related": [],
      "rationale": "기존 본문은 단순 제안 톤이었음.",
      "recommendation": "수정",
      "recommendation_reason": "allowlist 추출",
      "diff_hunk": ""
    },
    {
      "number": 3,
      "database_id": 3243171003,
      "thread_id": "PRRT_kwDOAAAAAA0000003",
      "url": "https://github.com/example/repo/pull/101#discussion_r3243171003",
      "updated_at": "2026-05-15T10:30:00Z",
      "last_edited_at": null,
      "is_outdated": false,
      "resolved_by": null,
      "validity": "partial",
      "tag": "suggestion",
      "path": "src/auth/token.ts",
      "line": 145,
      "reviewer": "alice",
      "resolved": false,
      "body": "이 retry loop 의 backoff 가 linear 인데 jitter 추가하면 thundering herd 줄어듭니다.",
      "summary": "backoff jitter",
      "replies": [],
      "related": [],
      "rationale": "타당하지만 영향 작음",
      "recommendation": "이슈 생성",
      "recommendation_reason": "PR 범위 밖",
      "diff_hunk": ""
    },
    {
      "number": 4,
      "database_id": 3243171004,
      "thread_id": "PRRT_kwDOAAAAAA0000004",
      "url": "https://github.com/example/repo/pull/101#discussion_r3243171004",
      "updated_at": "2026-05-15T09:12:00Z",
      "last_edited_at": null,
      "is_outdated": false,
      "resolved_by": null,
      "validity": "invalid",
      "tag": "suggestion",
      "path": "src/auth/store.ts",
      "line": 18,
      "reviewer": "bob",
      "resolved": false,
      "body": "이 부분 localStorage 대신 SecureStorage 쓰는 게 맞지 않나요?",
      "summary": "SecureStorage 권장",
      "replies": [],
      "related": [],
      "rationale": "이미 platform별 추상화됨",
      "recommendation": "반박",
      "recommendation_reason": "platform 어댑터 패턴",
      "diff_hunk": ""
    },
    {
      "number": 5,
      "database_id": 3243170900,
      "thread_id": "PRRT_kwDOAAAAAA0000900",
      "url": "https://github.com/example/repo/pull/101#discussion_r3243170900",
      "updated_at": "2026-05-14T11:00:00Z",
      "last_edited_at": null,
      "is_outdated": false,
      "resolved_by": null,
      "validity": "unclear",
      "tag": "question",
      "path": "src/auth/token.ts",
      "line": 200,
      "reviewer": "bob",
      "resolved": false,
      "body": "이 부분은 어떻게 처리하실 건가요? (이후 호출에서 사라질 예정의 코멘트)",
      "summary": "처리 방안 질문",
      "replies": [],
      "related": [],
      "rationale": "정보 부족",
      "recommendation": "논의",
      "recommendation_reason": "사용자 결정 필요",
      "diff_hunk": ""
    }
  ],
  "processing_order": [1, 2, 3, 4, 5],
  "generated_at": "2026-05-16T10:00:00Z"
}
